{
  "activation_requirement": "legacy_public_result_replay_authority_v1",
  "activation_status": "blocked",
  "benchmark_toolchain_registry_sha256": "5144fc19bbbbcf0ef16a1d7c88b163254f96a250cb4a5846fbbb0d465ce16790",
  "execution_profile_requirement": "historical_benchmark_toolchain_execution_profile_v1",
  "execution_profile_status": "unresolved",
  "github_evidence_aggregate_sha256": "13a0d95bd00cda236198d49c830159cb5790c9352b2fb1c6e94e07ec42787ecf",
  "inventory_sha256": "96f9b9f4950af3836c3cd10639c18c3a320348cf77b080e74daef2c0d30c2a10",
  "kind": "historical_public_replay_plan",
  "pending_request_count": 246,
  "requests": [
    {
      "activation_requirement": "legacy_public_result_replay_authority_v1",
      "benchmark": {
        "commit": "7699436464052268e6c04b41554bfbc2c6908ec5",
        "lean_toolchain_blob_sha256": "302cd63c54178885b89e669f33b38f12f4dd7ae7e5cac537b3203e3768d8fb2b",
        "repository": "leanprover/lean-eval",
        "toolchain": "leanprover/lean4:v4.33.0"
      },
      "declared_model": "github.com/mlgraham (Claude Fable 5)",
      "historical_accepted_at": "2026-08-20T02:42:13Z",
      "historical_evaluation": {
        "workflow_contract": "split_repository_recorded_benchmark_v1",
        "workflow_definition_sha256": "1d0650f3821f066e93f0b8432b2cecad43ffd8c0a9a66c3eb977422aeb356587",
        "workflow_repository_commit": "dffc2586bc874faf68b8af050015b010abb06643",
        "workflow_run_attempt": 1,
        "workflow_run_id": 32322489295,
        "workflow_run_identity_sha256": "410707302780b2ff6138980351c4f0fdf02366e9114b40d16ccfe2100983ad87"
      },
      "issue": {
        "identity_sha256": "0a0864cf2454f4460f8e2fdac51f530b1fc03fc43a462de93cb9ed15c898393d",
        "number": 1142,
        "repository": "leanprover/lean-eval-submissions"
      },
      "owner_login": "mlgraham",
      "request_id": "prr_05e899d7e694ef9df1b6ea26ed8e5a12d6a8248cc713d6192c10434a3680bdbd",
      "results": [
        {
          "owner_login": "mlgraham",
          "problem_id": "bvp_comparison",
          "result_file_sha256": "c00e0a5c0e3faa111d6cb91203bdf0e9f83b168685b56e7730c2c0f79065768a",
          "result_id": "r2_63d44a91004081421023a56993a4f27a1f4807a32fa0d3449ca8e9a1d4bb0702",
          "result_tree_digest": "0c622d2c8a859fb12c5401b7b317e66880f92938eea614820259bdf970d9d4b9",
          "results_commit": "5746f90e72e863d96d992938aea0609978d1560c",
          "results_path": "results/mlgraham.json",
          "results_repository": "leanprover/lean-eval-submissions",
          "statement_revision": 1
        },
        {
          "owner_login": "mlgraham",
          "problem_id": "sturm_separation",
          "result_file_sha256": "c00e0a5c0e3faa111d6cb91203bdf0e9f83b168685b56e7730c2c0f79065768a",
          "result_id": "r2_94e3685c301de537a63241262ed1e7a7c1634e0f1239c60f456b2559a849991c",
          "result_tree_digest": "0c622d2c8a859fb12c5401b7b317e66880f92938eea614820259bdf970d9d4b9",
          "results_commit": "5746f90e72e863d96d992938aea0609978d1560c",
          "results_path": "results/mlgraham.json",
          "results_repository": "leanprover/lean-eval-submissions",
          "statement_revision": 1
        },
        {
          "owner_login": "mlgraham",
          "problem_id": "posSemidef_map_exp",
          "result_file_sha256": "c00e0a5c0e3faa111d6cb91203bdf0e9f83b168685b56e7730c2c0f79065768a",
          "result_id": "r2_a87e4c14a4afde00be5b3eb603b96d78d446a6534f1cb1d9cd9b74a38282e4ff",
          "result_tree_digest": "0c622d2c8a859fb12c5401b7b317e66880f92938eea614820259bdf970d9d4b9",
          "results_commit": "5746f90e72e863d96d992938aea0609978d1560c",
          "results_path": "results/mlgraham.json",
          "results_repository": "leanprover/lean-eval-submissions",
          "statement_revision": 1
        }
      ],
      "source": {
        "commit": "42808fea2b805402ea022106b4150d355de77948",
        "kind": "github_repo",
        "repository": "mlgraham/lean-eval-submission",
        "visibility": "public"
      }
    },
    {
      "activation_requirement": "legacy_public_result_replay_authority_v1",
      "benchmark": {
        "commit": "e9a71a25a6bf3bed8dafd0dc32e45f16fe839a32",
        "lean_toolchain_blob_sha256": "2ca79bdfcf30c10b90f1bf037cf0f0d7528cf6b1f4a72a7f98ef17a2752d36af",
        "repository": "leanprover/lean-eval",
        "toolchain": "leanprover/lean4:v4.30.0-rc2"
      },
      "declared_model": "Aristotle (Harmonic)",
      "historical_accepted_at": "2026-05-13T12:07:46Z",
      "historical_evaluation": {
        "workflow_contract": "benchmark_repository_head",
        "workflow_definition_sha256": "ed6346b1eff4ba131e1e3d4fe2138c35502f4f378814900c47b991e5d79bb05f",
        "workflow_repository_commit": "e9a71a25a6bf3bed8dafd0dc32e45f16fe839a32",
        "workflow_run_attempt": 1,
        "workflow_run_id": 25797781587,
        "workflow_run_identity_sha256": "4f3b547481a5f363ccd29895782602601e0441fa14fd303a1b72f3603a13c5bd"
      },
      "issue": {
        "identity_sha256": "50fac8eedb6e6bbd542dd91d3264d3a8cf0884c27f596a46b74b05f11a235f7c",
        "number": 244,
        "repository": "leanprover/lean-eval"
      },
      "owner_login": "lorenzoluccioli",
      "request_id": "prr_10c3aa786395e4843b78b4487e980f20a38fff4635596b62e65bfe3bb2f38edf",
      "results": [
        {
          "owner_login": "lorenzoluccioli",
          "problem_id": "dvd_card_connectedComponent_markoffGraph",
          "result_file_sha256": "12b8504ca72ef73e31a7a757d0a5f9726fec309512486c58c787ca0ae78ab8f4",
          "result_id": "r2_961d31954c370b9c392cee57c192c9521cf90edcb98462a7aaaffaf28190922d",
          "result_tree_digest": "96cbe5ae5622ea96a48b34da3416e65efb181acb51e2e28e0ea71117cf3ce78d",
          "results_commit": "5746f90e72e863d96d992938aea0609978d1560c",
          "results_path": "results/lorenzoluccioli.json",
          "results_repository": "leanprover/lean-eval-submissions",
          "statement_revision": 1
        }
      ],
      "source": {
        "commit": "967a90b73db64a1939ef0fba144e183e35e97612",
        "kind": "github_repo",
        "repository": "LorenzoLuccioli/lean-eval",
        "visibility": "public"
      }
    },
    {
      "activation_requirement": "legacy_public_result_replay_authority_v1",
      "benchmark": {
        "commit": "bca50f854199f61225bbab22b653dbcab882315a",
        "lean_toolchain_blob_sha256": "ac52fbd2038f3138015950201a3f5067585cc1983a471a35604bde8369d28f24",
        "repository": "leanprover/lean-eval",
        "toolchain": "leanprover/lean4:v4.32.0-rc1"
      },
      "declared_model": "Kimi K2.7",
      "historical_accepted_at": "2026-07-10T11:07:53Z",
      "historical_evaluation": {
        "workflow_contract": "split_repository_recorded_benchmark_v1",
        "workflow_definition_sha256": "fa0889fb632a5856ec8c86a87c2c3e4f305409d927eb31b492198ea3990fbd1a",
        "workflow_repository_commit": "5221aed41d40125500d392fc9775366d73306350",
        "workflow_run_attempt": 1,
        "workflow_run_id": 29088049436,
        "workflow_run_identity_sha256": "5a96d9759045e0716e8099deb3dd29bae6b98901433a1cd46be3fb6ae26655d5"
      },
      "issue": {
        "identity_sha256": "6924a15bce10fe092afa847903e1412dfbb919e325a666250fce6c7a6457ad61",
        "number": 681,
        "repository": "leanprover/lean-eval-submissions"
      },
      "owner_login": "rwst",
      "request_id": "prr_11a0c0332c36a5796b2eb6156360972ef1b30c72924bf11d9668f345e6e5a6d5",
      "results": [
        {
          "owner_login": "rwst",
          "problem_id": "cubic_decay_asymptotic",
          "result_file_sha256": "1ccc0312a37f945a74e7c29eea6cc14315ea3a57db9d8a703d5158ef8f379311",
          "result_id": "r2_1020d7ef90a0c3f276f06e6d5d20c626d4063a2a5d682194b55d6b38fec51404",
          "result_tree_digest": "18ce0c56811cf4b5ed1a058c1af4cef94757fad342fa9a5594bd37bb7c4c9975",
          "results_commit": "5746f90e72e863d96d992938aea0609978d1560c",
          "results_path": "results/rwst.json",
          "results_repository": "leanprover/lean-eval-submissions",
          "statement_revision": 1
        }
      ],
      "source": {
        "commit": "31793aa34225d12440d2ded270af408e71f2dfb3",
        "kind": "github_repo",
        "repository": "rwst/lean-eval",
        "visibility": "public"
      }
    },
    {
      "activation_requirement": "legacy_public_result_replay_authority_v1",
      "benchmark": {
        "commit": "bca50f854199f61225bbab22b653dbcab882315a",
        "lean_toolchain_blob_sha256": "ac52fbd2038f3138015950201a3f5067585cc1983a471a35604bde8369d28f24",
        "repository": "leanprover/lean-eval",
        "toolchain": "leanprover/lean4:v4.32.0-rc1"
      },
      "declared_model": "Grok 4.5",
      "historical_accepted_at": "2026-07-22T18:26:11Z",
      "historical_evaluation": {
        "workflow_contract": "split_repository_recorded_benchmark_v1",
        "workflow_definition_sha256": "fa0889fb632a5856ec8c86a87c2c3e4f305409d927eb31b492198ea3990fbd1a",
        "workflow_repository_commit": "9f51690f5b261e1892b965a6aed4eeef19f92d15",
        "workflow_run_attempt": 1,
        "workflow_run_id": 29946214267,
        "workflow_run_identity_sha256": "ec9c95cbcf9cbd3b265af93a01efbc8b9869eef37678c5af4353a40e604ed933"
      },
      "issue": {
        "identity_sha256": "3b5d6e79dd1713383137f19f2ec93dafb2f7c85e9204be15ce4c8cfd2bac3ace",
        "number": 864,
        "repository": "leanprover/lean-eval-submissions"
      },
      "owner_login": "rwst",
      "request_id": "prr_125c12cb4e5d1608c5dc8009d4ee87efe5875a6624554a70dfb7ed6368f4251e",
      "results": [
        {
          "owner_login": "rwst",
          "problem_id": "cubic_decay_asymptotic",
          "result_file_sha256": "1ccc0312a37f945a74e7c29eea6cc14315ea3a57db9d8a703d5158ef8f379311",
          "result_id": "r2_c43c3f64c4dd78e1738a017881bc3d50f1e60b43b601ec2dc76240c99a100848",